{"timestamp":"2026-09-20T12:00:00Z","level":"INFO","service":"example-api","environment":"prod","version":"sha-abc123","logger":"com.example.Api","event":"http.request.completed","message":"HTTP request completed","requestId":"req-42","traceId":"4bf92f3577b34da6a3ce929d0e0e4736","spanId":"00f067aa0ba902b7","httpMethod":"GET","httpPath":"/api/v1/services/{id}","httpStatus":200,"durationMs":18,"outcome":"success"}
